Name,Type,Capacity,Rate_Per_Hour,Amenities,Description
The Grand Hall,Indoor,200,1500,"AC,Sound System,Stage,Projector,Changing Room","An elegant, high-ceiling ballroom perfect for weddings, debuts, and corporate galas."
Sunset Resort,Outdoor,50,2250,"Swimming Pool,BBQ Pit,Cabana,Private Shower,Karaoke","A relaxing outdoor oasis with a private pool. Ideal for family outings, team buildings, and casual birthdays."
The Executive Suite,Indoor,20,750,"High-speed Wifi,Smart TV,Whiteboard,Conference Table,Coffee Machine","A professional, sound-proofed environment designed for board meetings, workshops, and brainstorming sessions."
The Secret Garden,Outdoor,15,1200,"Gazebo,Flower Arch,Ambient Lighting,Garden Furniture","A small, intimate botanical setting. Perfect for romantic proposals, photoshoots, or tea parties."
Skyline Roof Deck,Semi-Outdoor,100,3000,"Bar Counter,DJ Booth,Lounge Seating,City View,Retractable Roof",A modern rooftop venue with stunning city views. Great for cocktail parties and evening socials.